{"allocation_schema_version":1,"allocations":[{"allocated_capital_usd":"60000.00","expected_sharpe":"1.45","strategy_id":"strat.trend.v1","target_weight_bps":6000},{"allocated_capital_usd":"30000.00","expected_sharpe":"1.20","strategy_id":"strat.meanrev.v1","target_weight_bps":3000}],"approved_by_policy":true,"cash_reserve_bps":1000,"created_at":"2026-09-04T19:00:00Z","plan_id":"alloc-plan.q3-001","risk_policy_version":"risk-policy-2026-v1","total_capital_usd":"100000.00"}
